Example,Class Name
Você sabe me dizer se o porco sofreu,porco_morto
o porco tem família,família_porco
Você tem família,família_porco
quantos anos tem um pouco,idade_porco
a qual escola essa hora pertence,estilo_obra
por porque eu porque está preso,porco_preso
o que você está fazendo aí porco,porco_preso
qual é a sua história,história_porco
me fale sobre sua história,história_porco
porque você veio do celeiro,história_porco
quando que ele peso por,peso_porco
o porco é um animal esculpe de madeira,tipo_obra
Quantos anos tem essa obra,data_obra
os anos você tem por,sem_compreensão
quem é você por,nome_porco
quem é o autor desta obra,autor_obra
quem que criou o setor,autor_obra
você é menino menina,sexo_porco
em que ano foi feita,data_obra
a obra de que ano,data_obra
qual a história do artista,biografia_autor
Mas esse porco morreu,porco_morto
esse povo tinha família,família_porco
porque você está numa grade,porco_preso
porque você está numa caixa,porco_preso
porque ele está preso,porco_preso
porque está indo engradado de madeira,porco_preso
quem é esse porco,história_porco
quantos anos não sobra,sem_compreensão
seu sexo feminino masculino,sexo_porco
qual é o ano de criação da obra,data_obra
Quando que ele morreu,porco_morto
você vai morrer,porco_morto
quantos anos tem esse porco,idade_porco
porque você está preso,porco_preso
de onde é o porco,história_porco
era um porco de estimação,história_porco
esse porém esculpido em barreira,tipo_obra
E o que é arte,sem_resposta
O que é arte,sem_resposta
Quem define o que é arte,sem_resposta
Qual é a nacionalidade desse artista,nascimento_autor
quantos anos tem a obra,data_obra
Quantos anos tem essa de porco,sem_compreensão
quantos anos ele vive/,porco_morto
Qual é a idade dessa obra,data_obra
Ele morreu há quantos anos,porco_morto
Pouco está pronto para o abate,porco_morto
você conhece a pé pra pig,relação_peppa_pig
você é palmeirense,palmeiras_porco
quem que criou,autor_obra
Quem fez o porco,autor_obra
quem é o artista,autor_obra
quantos kilo ele pensava,peso_porco
quantos anos você tem,idade_porco
esse porque é palmeirense,palmeiras_porco
quem criou esta ópera,autor_obra
quem é esse porra,autor_obra
a obra no total tem quantos quilos,peso_porco
qual o nome do seu qual o nome do seu artista,autor_obra
qual é o peso do porco,peso_porco
quantos que ele peça,peso_porco
de quem é a sogra,autor_obra
mas fede você ver quantos quilos você pesa,peso_porco
Você é amiga da TAP,relação_peppa_pig
qual é o nome do artista dessa obra,autor_obra
ele é palmeirense,palmeiras_porco
o artista te criou,autor_obra
qual é o nome do autor da obra,autor_obra
quantos quilos peças por,peso_porco
é macho fêmea,sexo_porco
que idade tem o porco,idade_porco
qual nome do criador da obra,autor_obra
qual o nome do autor da obra,autor_obra
quem criou a obra,autor_obra
você torce pra que time,palmeiras_porco
qual é o ator,autor_obra
quem foi o autor,autor_obra
Quem criou isso,autor_obra
qual o peso da obra,peso_porco
quem o colocou aí dentro,autor_obra
Pergunta quem te fez qualquer coisa,autor_obra
quantos anos ele tinha,idade_porco
nome do autor,autor_obra
quem fez o porto,autor_obra
quem te criou,autor_obra
Quem fez e quem é o seu autor,autor_obra
quem criou esse pouco,autor_obra
qual o peso do pânico,peso_porco
quantos anos esse porque eu tenho,idade_porco
quantos anos eu perco tinha,idade_porco
você conhece a pipa pig,relação_peppa_pig
Qual o autor,autor_obra
de quem essa obra,autor_obra
de quem é a obra,autor_obra
quem fez a obra,autor_obra
Quem foi o autor dessa obra tirar,autor_obra
qual é o nome de quem fez você,autor_obra
watson quem é o autor dessa obra,autor_obra
quem foi que te criou,autor_obra
quem foi que te fez,autor_obra
você é pé papi ligue que eu,relação_peppa_pig
quem criou a outra,autor_obra
quem é o autor dessa obra,autor_obra
quantos quilos tem essa obra,peso_porco
quantos anos você tem tem 50,idade_porco
qual que é o nome do artista,autor_obra
quem fala quem é o seu artista,autor_obra
você é parente da topique,relação_peppa_pig
quem fez essa obra de arte,autor_obra
você é amigo da pé pe,relação_peppa_pig
quem é o autor,autor_obra
quem foi que ele criou,autor_obra
gente fez,autor_obra
qual artista,autor_obra
quem foi o autor da obra o porco,autor_obra
qual o autor dessa obra,autor_obra
qual o peso desse porco,peso_porco
estão estão exemplar macho ou fêmea,sexo_porco
quantos anos tem whatsapp o porco,idade_porco
quem criou,autor_obra
palmeirense,palmeiras_porco
quem é o autor do porco,autor_obra
qual é o artista desenvolveu essa obra,autor_obra
quantos quilos você tem,peso_porco
qual o nome do artista,autor_obra
você tem quantos anos,idade_porco
de quem é esse porco,endereço_obra
puto com você é fêmea ou macho,sexo_porco
quem é o autor da obra,autor_obra
qual autor da obra,autor_obra
WhatsApp de quem essa obra,autor_obra
Que que é né o autor,autor_obra
quanto você pesa,peso_porco
quem teve essa ideia,autor_obra
quem foi o autor dessa obra,autor_obra
quantos anos você tem,idade_porco
quantos quilos pesa esse porco,peso_porco
o porque é homem ou mulher,sexo_porco
Qual o material usado nesta obra do porco,técnica_obra
De que você é feita,técnica_obra
Do que é feita a pele,técnica_obra
que material é utilizado,técnica_obra
você é corinthíano,palmeiras_porco
porque eu toco foi morto,porco_morto
porque que você está aí dentro,porco_preso
preso,porco_preso
pai que está preso,porco_preso
você está vivo,tipo_obra
propor com ele ele é de verdade,tipo_obra
O porco era de verdade,tipo_obra
esse porque é de verdade,tipo_obra
o porco é de verdade,tipo_obra
porta de mentira,tipo_obra
quantos anos tem suporte,idade_porco
pode tocar não for,sem_resposta
Qual é a finalidade,intenção_autor
O que representa,intenção_autor
Fala porque o artista é enjaulou esse pouco que foi que ele quis representar com isso,intenção_autor
qual o sentido subjetivo da arte,intenção_autor
qual objetivo da obra,intenção_autor
qual objetivo com doutor que o assunto,intenção_autor
qual objetivo da ópera,intenção_autor
e porque ele fez essa obra,intenção_autor
o que ele queria com essa obra,intenção_autor
qual time que acho que torci,palmeiras_porco
qual o peso estimado desse porco,peso_porco
você é um porco de verdade,tipo_obra
o animal está empalhado em,tipo_obra
porque eu pouco está dentro da jaula,porco_preso
porque esse porque está preso,porco_preso
qual nome do povo,nome_porco
do que é feito essa escultura,técnica_obra
porque o porco está fechado,porco_preso
você é palmeirense,palmeiras_porco
o pouco o porco veio de que país,história_porco
eu posso encostar você,sem_resposta
porque ele escolheu porco,razão_porco
porque eu porque está dentro da caixa,porco_preso
o autor brasileiro,nascimento_autor
por que um porco,razão_porco
o que é sobra,tipo_obra
que quando é a obra,data_obra
de quem é o porco,endereço_obra
quem fez a obra,autor_obra
quem foi o artista desta obra,autor_obra
qual é o autor dessa obra o porco,autor_obra
pode ser um qual o nome do autor dessa obra,autor_obra
quantos anos tem o porco,idade_porco
qual é o peso de aproximadamente,peso_porco
quanto que você pede esse porco,peso_porco
é menina ou menino,sexo_porco
o porco é fêmea ou macho,sexo_porco
Porque foi usado um porco,razão_porco
quais materiais foram utilizados para fazer um favor pra,técnica_obra
Quais são os materiais usados em você,técnica_obra
qual o material do porco,técnica_obra
qual é o material da obra,técnica_obra
de qual material é feito o porco,técnica_obra
você torce pro palmeiras,palmeiras_porco
ele foi morto,porco_morto
quem o matou,porco_morto
morto quando,porco_morto
De onde veio essa obra,local_criação_obra
porque pois ele na caixa de madeira,porco_preso
por o que quero e você está preso,porco_preso
porque que ele está preso,porco_preso
como que você foi parar aí dentro dessa caixa e vou dizer,porco_preso
porque você está dentro dessa caixa,porco_preso
porque você está nessa gaiola,porco_preso
o porque o porque de verdade,tipo_obra
esse porque de verdade,tipo_obra
recíproca de verdade,tipo_obra
pouco de verdade,tipo_obra
O que é isso,tipo_obra
Ei de verdade,tipo_obra
então porque é um porco de verdade,tipo_obra
Porco de verdade,tipo_obra
esse papo de verdade,tipo_obra
você é de verdade você de verdade,tipo_obra
Ele foi um verdade,tipo_obra
você tem pelo de verdade,tipo_obra
é uma altura só,tamanho_porco
e o que significa,intenção_autor
qual era a intenção do artista,intenção_autor
qual o significado dessa hora,intenção_autor
O que esse puto representa,intenção_autor
Qual o seu significado,intenção_autor
Qual a proposta da obra,intenção_autor
Pra que o que ele simboliza,intenção_autor
O que eu disse eu estava pensando quando ele criou essa obra que ele quis mostrar,intenção_autor
Qual é a crítica,intenção_autor
O que está obra representa,intenção_autor
qual é o significado da obra,intenção_autor
qual é intenção dessa obra,intenção_autor
quantos anos o porque eu tinha antes de morrer,idade_porco
sobre o que essa obra se retrata,intenção_autor
qual intenção da obra,intenção_autor
o que o artista se quis dizer com essa obra,intenção_autor
O que é um porco,sobre_porco
o porco é macho é fêmea,sexo_porco
perca macho fêmea,sexo_porco
quem prendeu,autor_obra
por quem foi criado,autor_obra
quem fez esse porco,autor_obra
quantos anos tem esse pouco,idade_porco
qual é o peso da obra,peso_porco
quanto é que ele pesa você tem que falar quanto por,peso_porco
de que material ele foi feito,técnica_obra
O que você é feito,técnica_obra
Que o material foi utilizado nesse escultura do Paul,técnica_obra
que material é feito a obra o porco,técnica_obra
como foi feito essa obra de arte qual o material usado na sobra de ar,técnica_obra
isso porque é palmeirense,palmeiras_porco
quem é o mato,porco_morto
porque ele está numa gaiola,porco_preso
porque eu porque está em uma gaiola,porco_preso
o cara que você está triste,sentimento_porco
O Porto é de verdade,tipo_obra
mas era um porco de verdade,tipo_obra
ele é um porco,tipo_obra
esse é um porco de verdade,tipo_obra
ele é um animal de verdade empalhado,tipo_obra
ah então ele era um pouco vivo de verdade,tipo_obra
watson,outras_inteligências_artificiais
qual foi a ideia do artista,intenção_autor
o que o artista representou com a obra,intenção_autor
ok nelson quis dizer,intenção_autor
porque significa,intenção_autor
qual objetivo dessa obra,intenção_autor
qual objetivo da sobra,intenção_autor
qual a finalidade colocar um pouco como obra em uma exposição,intenção_autor
o que está obra significa,intenção_autor
isso é considerado o marco,dúvida_obra
Tour dessa obra ele fez outras obras,outras_obras
esse porco é do palmeiras,palmeiras_porco
qual o peso da obra,peso_porco
esse é um pouco de verdade,tipo_obra
porque eu posto porque está encaixotado,porco_preso
porque ele está preso,porco_preso
oi porque que eu porque está na jaula,porco_preso
em que ano mais ou menos que foi feita essa obra,data_obra
porque que ele fez um porco,razão_porco
se você fosse de verdade seria palmeirense,palmeiras_porco
pode mexer no porco,sem_resposta
quem fez essa,autor_obra
qual artista dessa obra,autor_obra
ele é marido da pé papi fala filha maria,relação_peppa_pig
quantos anos o porco termine,idade_porco
quantos quilos tem esse porco,peso_porco
ele é fêmea ou macho,sexo_porco
Qual o material foi inutilizado pra fazer essa obra,técnica_obra
de que que ele é feito,técnica_obra
que material é feito por,técnica_obra
O que você é feita,técnica_obra
esse porco é palmeirense,palmeiras_porco
qual é a raça,raça_ porco
de que movimento artístico faz essa faz parte é só pra,estilo_obra
porque ele sente preso,porco_preso
porque você está presa aí,porco_preso
ele está feliz,sentimento_porco
qual o intuito da obra,intenção_autor
O que significa o porco,intenção_autor
do que se trata a obra,intenção_autor
Olha que eu tentava hora que sair né vai que eu terminar aqui falo negócio é levar já pode falar a a linda né alguém da sua família,sem_resposta
qual é o valor estimado da obra,valor_obra
quanto você pesa,peso_porco
quem é o autor,autor_obra
porque o porco está preso,porco_preso
qual é o nome do artista,autor_obra
Qual o material usado na obra,técnica_obra
com que material é esse porco foi feito,técnica_obra
quais materiais foram usado na obra,técnica_obra
do que morreu,porco_morto
qual estilo de,estilo_obra
como você está sentindo aí,sentimento_porco
esse corpo de verdade,tipo_obra
você era de verdade,tipo_obra
esse porque foi de verdade,tipo_obra
quem outor,autor_obra
inspiração,intenção_autor
O que significa essa obra do porco,intenção_autor
Qual o sentido da obra,intenção_autor
qual foi o propósito da obra,intenção_autor
qual foi a motivação,intenção_autor
o que o artista quis passar com essa obra pouco,intenção_autor
Há quanto tempo você está aí,Tempo_porco_caixa
qual é o peso do animal,peso_porco
Você empalhado,tipo_obra
qual nome do autor do,autor_obra
quem é o colocou nessa caixa,autor_obra
de quem é a obra,autor_obra
quantos anos o porco tem,idade_porco
quanto que ele pesa,peso_porco
é quanto quanto ele pesa,peso_porco
você é macho é fêmea,sexo_porco
Qual o material utilizado para sauna,técnica_obra
de que é feito por,técnica_obra
como você foi feita,técnica_obra
então eu não você foi feito,técnica_obra
quais as técnicas e processos de lizardo os na confecção do pouco,técnica_obra
de você torce,palmeiras_porco
era selvagem ela não,raça_ porco
qual é a raça desse pouco,raça_ porco
quando ele morreu,porco_morto
em que movimento artístico ela se enquadra,estilo_obra
porque eu porque só numa gaiola e não lhe,porco_preso
porque que ele está na caixa de madeira,porco_preso
como você se sente preso,sentimento_porco
o porra o porco ele é de verdade ou não,tipo_obra
Era um porco de verdade ou é isso,tipo_obra
é um porco de verdade,tipo_obra
qual o conceito da obra,intenção_autor
O que significa obra,intenção_autor
Qual mensagem passa e esse pouco,intenção_autor
porque ele é tão importante,intenção_autor
qual foi a ideia do criador da obra,intenção_autor
qual foi o motivo da obra,intenção_autor
De que ano é essa obra,data_obra
qual é o valor dessa obra,valor_obra
quantos quilos tem esse porco,peso_porco
o porco empalhado,tipo_obra
É um animal empalhado,tipo_obra
quem é o artista que fez,autor_obra
porque o que ele está preso guardado,porco_preso
qual a escola dart,estilo_obra
Que Madeira foi feita essa caixa,caixa_porco
porque eu porque está preso nessa gaiola,porco_preso
que o porco faz,sem_resposta
quando você foi pintado,data_obra
em que ano essa obra foi cita,data_obra
porque eu por o que está dentro da caixa,porco_preso
qual o nome do autor da obra,autor_obra
pode com você é de verdade,tipo_obra
porque eu porque está numa gaiola,porco_preso
quem define o que é arte,sem_resposta
qual é o autor,autor_obra
a obra brasileira,local_criação_obra
quem é o autor,autor_obra
quantos quilos tem um porco,peso_porco
qual o peso estimado,peso_porco
esse porque a menina ou menino,sexo_porco
Como está a obra foi feita,técnica_obra
como foi feita essa obra,técnica_obra
com que material fez seita,técnica_obra
você é feito do que você é feito do que por,técnica_obra
pergunta se ele é palmeirense ver que ontem não sei eu perdi o começo,palmeiras_porco
colocou a forma em que o porco morreu,porco_morto
por que ele está preso,porco_preso
porque você está presa,porco_preso
porque você está nessa faixa,porco_preso
o porco é de verdade ou não,tipo_obra
Você é real,tipo_obra
porque eu te verdade,tipo_obra
Que que significa essa obra,intenção_autor
Qual objetivo do autor,intenção_autor
Qual intuito da obra,intenção_autor
O que que essa hora significa,intenção_autor
o que o artista representa com a obra,intenção_autor
qual a intenção de nelson de criar outro,intenção_autor
que ele pretendeu com essa obra,intenção_autor
porque eu porque é considerado uma obra de arte,dúvida_obra
o porco é macho fêmea,sexo_porco
e se for for de verdade,tipo_obra
de quem é o porco,endereço_obra
qual o nome do autor desta obra,autor_obra
porco quem fez,autor_obra
quantos anos esse pouco tem,idade_porco
quantos quilos você tem,peso_porco
o pôr para fêmea ou macho,sexo_porco
Você é feito do que,técnica_obra
qual material você é feito,técnica_obra
qual o material da obra,técnica_obra
de que material ser feito,técnica_obra
qual o material utilizado para fazer essa hora,técnica_obra
de que material é feita,técnica_obra
esse porco palmeirense,palmeiras_porco
qual a raça desse porco,raça_ porco
você está feliz itaí preso aí,porco_preso
porque que você está preso,porco_preso
O que é esse porco,tipo_obra
Qual o sentido dessa obra,intenção_autor
Qual é o propósito da obra,intenção_autor
o que representa a obra,intenção_autor
quanto esse porco pesa,peso_porco
porque você está preso no caixote de madeira,porco_preso
porque eu porque está na jaula,porco_preso
porque ele está com a jaula,porco_preso
caixa de madeira,caixa_porco
quem foi o autor,autor_obra
qual o nome do autor da obra,autor_obra
quem é a obra,autor_obra
quantos anos ele tem,idade_porco
Como a obra foi feita,técnica_obra
Quais materiais foram utilizados para para essa obra,técnica_obra
Ficou material é feito,técnica_obra
O material te Lizardo,técnica_obra
pra que time você torce,palmeiras_porco
ela é arte moderna what contemporânea,estilo_obra
porque ele colocou porco na caixa de madeira,porco_preso
porque ele escolheu colocado dentro de uma grade,porco_preso
porque você está aí,porco_preso
essa obra é feita com animal real,tipo_obra
Um pouco de verdade,tipo_obra
tem certeza do que eu porque é de verdade,tipo_obra
o que essa arte representa,intenção_autor
Qual foi a intenção do autor,intenção_autor
qual o motivo da obra e qual o significado,intenção_autor
mas qual o significado da ação,intenção_autor
qual o significado da obra de arte,intenção_autor
Você está comendo só comida,sem_resposta
Onde nasceu autor,nascimento_autor
quem é o seu autor,autor_obra
porque o porque que você é tão sujo,sem_resposta
de quem essa obra,autor_obra
quantos quilos você,peso_porco
ele é macho ou fêmea,sexo_porco
Que material foi utilizado para obra,técnica_obra
Como eu sou feita de escultura,técnica_obra
do que você é feito,técnica_obra
qual material utilizado para fazer a obra,técnica_obra
você é feito do que,técnica_obra
porque você é palmeirense,palmeiras_porco
por porque ele está dentro dessa grade,porco_preso
você é feliz dentro de uma caixa apertado,sentimento_porco
o porco real ou é só pra,tipo_obra
o porco é real,tipo_obra
Você mora na fazenda,endereço_obra
Qual a intenção da obra,intenção_autor
Que você o que você quis dizer com essa obra,intenção_autor
O que significa porco,intenção_autor
qual mensagem da obra,intenção_autor
qual é o objetivo do porco,intenção_autor
aqui porco olhada considerado arte,dúvida_obra
esse porco de verdade,tipo_obra
qual é o nome do autor,autor_obra
quem criou esse,autor_obra
por quantos kilo que você tem,peso_porco
qual o peso dele,peso_porco
quanto pesa esse porco,peso_porco
é fêmea ou macho,sexo_porco
é macho ou é fêmea,sexo_porco
por que é macho fêmea,sexo_porco
Do que é feito pra essa obra,técnica_obra
Qual o material utilizado na obra,técnica_obra
Do que é feito o pelo do por,técnica_obra
qual o material utilizado,técnica_obra
você é feito de que,técnica_obra
qual material usado para construção da obra,técnica_obra
quais os materiais usados,técnica_obra
quais cores materiais usados para criar o porquinho,técnica_obra
para que time ele torce,palmeiras_porco
sabe se a raça do porco,raça_ porco
como você morreu,porco_morto
como porco morreu,porco_morto
você morreu velho,porco_morto
Porque eu porque está num num esterco de madeira,porco_preso
porque eu porque está presa,porco_preso
porque ele fica dentro desse negócio,porco_preso
porque que ele está entre as grades,porco_preso
o porco feliz ou triste,sentimento_porco
esse perca de verdade,tipo_obra
olá esse porque é de verdade,tipo_obra
você porque é de verdade,tipo_obra
o que você é,tipo_obra
Qual o motivo dessa obra,intenção_autor
qual crítica obra traz,intenção_autor
essa ideia do autor de ter um porre surgiu a partir do que,intenção_autor
Explica essa obra,intenção_autor
O que que essa obra apresenta,intenção_autor
Significa obra,intenção_autor
O que representa a obra,intenção_autor
Qual é o significado da ópera,intenção_autor
qual objetivo do autor,intenção_autor
você é palmeirense,palmeiras_porco
quanto pesa,peso_porco
este porto real,tipo_obra
você é um animal empalhado,tipo_obra
quem fez essa obra,autor_obra
Queria saber sobre a obra um pouco,história_porco
watson de quem essa obra,autor_obra
quem é o artista da sogra,autor_obra
quem é o seu criador,autor_obra
quem é o ato o autor,autor_obra
vou por que é macho fêmea,sexo_porco
qual material utilizado pra ser feito esta obra,técnica_obra
qual foi a técnica utilizada,técnica_obra
de que material é feito o porco,técnica_obra
porque corinthíano,palmeiras_porco
porque você morreu porque você morreu,porco_morto
porque que ele está numa caixa está empalhado,porco_preso
porque você está preso,porco_preso
você gosta de ficar aí,sentimento_porco
Você é um porco de verdade,tipo_obra
o autor tem outro nome,autor_obra
O que essa obra representa,intenção_autor
o que significa,intenção_autor
eu te vertesse quis dizer com a obra,intenção_autor
quem fez o porco,autor_obra
porque ele está na jaula,porco_preso
qual autor dessa obra,autor_obra
quem criou essa obra de arte,autor_obra
quem é o autor dessa obra,autor_obra
qual a idade do porco,idade_porco
quanto pesa um pouco,peso_porco
quantos quilos tem esse for,peso_porco
quantos quilos de porco perva,peso_porco
Qual a técnica utilizada,técnica_obra
Do que você é feito,técnica_obra
você é feito de qual material,técnica_obra
os materiais utilizados,técnica_obra
qual material usado,técnica_obra
você torce para o palmeiras,palmeiras_porco
ele é palmeirense,palmeiras_porco
porque ele morreu,porco_morto
onde foi feito a obra,local_criação_obra
porque eu porque eu está presa,porco_preso
porque eu posso estar dentro da caixa,porco_preso
o porco não é de verdade,tipo_obra
porque de verdade,tipo_obra
Qual é o significado,intenção_autor
O que o artista queria dizer com essa obra,intenção_autor
Qual significado da sorte,intenção_autor
qual a inspiração da obra,intenção_autor
qual o significado da obra,intenção_autor
o que o autor se inspirou para fazer essa obra,intenção_autor
que ela é uma obra de arte,dúvida_obra
é que time você torce,palmeiras_porco
esse porco é real,tipo_obra
quem produziu essa obra de arte,autor_obra
porque você está preso,porco_preso
essa madeira forte e resistente,caixa_porco
essa obra gosta de ser admirada pelos outros,sem_resposta
o porco é legal não,sem_resposta
porque o rabo do porco peludo,sem_resposta
quanto pesa o porco,peso_porco
pode tocar no porco,sem_resposta
isso porque é palmeirense,palmeiras_porco
do que o que foi isso é feito,técnica_obra
esse porto tem nome,nome_porco
os pelos do porcos são de verdade,tipo_obra
ele é um porco embalsamado,tipo_obra
ele é marido da pipa pig,relação_peppa_pig
quanto ele pesa,peso_porco
quantos quilos pesa,peso_porco
Qual o material do Porto,técnica_obra
como que essa obra feita,técnica_obra
de que é feito esse porco,técnica_obra
por que é material com o porco foi feito,técnica_obra
você é feito do que pórtico,técnica_obra
você é palmeirense,palmeiras_porco
quando você morreu,porco_morto
como esse porco morreu,porco_morto
porque ele colocou esse porco em uma caixa,porco_preso
você é feliz,sentimento_porco
É que perca de verdade,tipo_obra
é um por favor de verdade,tipo_obra
Porco é de verdade ou é desmentira,tipo_obra
Esse porco é de verdade,tipo_obra
o que é isso,tipo_obra
e o que ele quis dizer com a obra,intenção_autor
Qual a inspiração do artista,intenção_autor
O que é saber o significa,intenção_autor
qual o significado,intenção_autor
qual é a proposta da obra,intenção_autor
objetivo da obra,intenção_autor
no que se baseia sua obra,intenção_autor
porque você é uma obra de arte,dúvida_obra
porque você porque eu ver uma obra de arte,dúvida_obra
que time você torce,palmeiras_porco
qual é o tipo de madeira da caixa,caixa_porco
De de madeira feita caixa,caixa_porco
de quem você pertence,endereço_obra
quem prendeu você perdeu vai ser,autor_obra
qual é o nome inteiro do autor que fez esta obra,autor_obra
porquinho quantos anos você tem,idade_porco
qual o peso,peso_porco
Qual é o significado da obra,intenção_autor
que material é feito esse porco,técnica_obra
que bom que era corintiano,palmeiras_porco
que está morto porque me responde,porco_morto
porque que ele está presa,porco_preso
como se sente sendo olhado,sentimento_porco
ele é de verdade,tipo_obra
O que ele representa,intenção_autor
O que ele significa,intenção_autor
com qual objetivo,intenção_autor
quem é o autor autor,autor_obra
você é homem mulher,sexo_porco
porque o artista fez agora,autor_obra
quem fez você,autor_obra
nome do autor,autor_obra
ele é irmão da pepa pig,relação_peppa_pig
qual o peso desse por,peso_porco
qual o peso por,peso_porco
Como foi feita,técnica_obra
Qual o material utilizado meu amor,técnica_obra
você é feito no que,técnica_obra
de que é feita essa obra,técnica_obra
o por que é palmeirense,palmeiras_porco
