Example,Class Name
qual é a data do quadro?,data_obra
quando o quadro foi feito?,data_obra
quando esta obra foi feita?,data_obra
qual é a data desta obra?,data_obra
Qual é a data desta obra?,data_obra
Quem pintou este quadro?,autor_obra
Qual o autor desta obra?,autor_obra
quem fez esta obra?,autor_obra
quem fez este quadro?,autor_obra
Quem é o autor desta obra?,autor_obra
Por que a caixa é de madeira?,caixa_porco
Voce acredita que esta caixa consegue segurar este porco?,caixa_porco
Quem era o presidente?,presidente_época
Quem mandava no Brasil nessa época?,presidente_época
Quem governava o país?,presidente_época
O que acontecia no mundo no ano em que você foi pintado?,obra_contexto_histórico
Quando essa obra foi feita?,data_obra
De quando é a obra?,data_obra
Onde foi pintada?,local_criação_obra
Ele está preso para ser abatido?,porco_morto
Como ele foi transportado até lá,transporte_porco
Quem é o autor desta obra?,autor_obra
Qual foi a inspiracao que o artista teve para esta peca? E por que o porco preso em um caixote?,intenção_autor
Por que ele está preso?,porco_preso
Por que esse porco está preso?,porco_preso
Por que esse porco está preso?,porco_preso
Por que o porco esta preso ?,porco_preso
por que o porco esta preso?,porco_preso
onde podemos encontrar essa obra?,endereço_obra
Por que o porco esta preso?,porco_preso
por que o porco está preso?,porco_preso
Por que o porquinho ta preso? ,porco_preso
Por quê você está preso?,porco_preso
Porque ele está preso?,porco_preso
Porque o animal está preso?,porco_preso
porque o porco está preso?,porco_preso
Porque o porco está preso?,porco_preso
Porque o posto está preso ?,porco_preso
Porque você tá preso?,porco_preso
qual o autor,autor_obra
Quando Nelson Leirner criou a obra?,data_obra
Ele é palmeirense?,palmeiras_porco
porque isso é considerado uma obra?,dúvida_obra
Quem é o autor desta obra?,autor_obra
qual o tipo de madeira da caixa?,caixa_porco
qual é a madeira usada na caixa?,caixa_porco
qual é a madeira utilizada no engradado?,caixa_porco
que tipo de material é feito essa madeira?,caixa_porco
essa caixa era de madeira?,caixa_porco
qual a cor da grade ?,caixa_porco
é porco ou porca?,sexo_porco
qual a importancia desta obra para as artes?,importância_obra
O porque eu estava vivo ou tava morto naquela situação,porco_morto
Porque que você está na caixa,porco_preso
Qual é nela pra,sem_compreensão
Você acha,sem_compreensão
Por que este porco está preso na caixa ?,porco_preso
O que o artista quis dizer com essa obra?,intenção_autor
Um porco? O que ele quis dizer com isto?,intenção_autor
quem é nelson leirner?,biografia_autor
quem é Nelson leirner?,biografia_autor
Quem foi Nelson Leirner? ,biografia_autor
Por que o animal está preso?,porco_preso
Qual é a história desse quadro?,história_porco
por que isso é considerado arte?,dúvida_obra
Por que isto é uma obra de arte ? ,dúvida_obra
O que a imagem do porco representa?,intenção_autor
O que a obra significa?,intenção_autor
o que o artista quis relatar com esta obra ? ,intenção_autor
o que o pintor queria retrarar?,intenção_autor
o que o pintor quis mostrar com esta gaiola com um porco ?,intenção_autor
O que passava na cabeça do pintor pra pintar um porco?,intenção_autor
O que se quis dizer com isso?,intenção_autor
Porque esta ai?,intenção_autor
qual a mensagem subliminar ?,intenção_autor
Qual o sentido de retratar um porco na gaiola?,intenção_autor
Qual o significado da sua pintura para a epoca que foi pintado?,intenção_autor
qual o significado desta obra ? ,intenção_autor
Que sentimento queria passar?,intenção_autor
Qual o sentido dessa obra?,intenção_autor
Por que o porco está preso?,porco_preso
Esta imagem representa uma agressão ao porco ?,porco_morto
Isso é mesmo considerado obra de arte?????,dúvida_obra
Em que ano você foi pintado?,data_obra
Em que ano foi pintado o quadro?,data_obra
Em que ano foi feita essa Obra?,data_obra
Qual é o ano da obra?,data_obra
"O que esse trabalho significa para a arte contemporânea brasileira, isto é, com o que ela está dialogando? ",intenção_autor
O que o artista imaginou passar com esta imagem bizarra?,intenção_autor
O que significa essa obra?,intenção_autor
O que significa essa obra?,intenção_autor
Será que Nelson estava pensando na violência que os animais sofrem quando estão prestes a ir para o abate?,intenção_autor
O que significa o porco estar preso na caixa?,porco_preso
De onde veio a ideia de fazer uma obra de arte com um porco numa caixa?,porco_preso
por que o porco está na caixa?,porco_preso
O palmeiras vai ser campeão esse ano?,palmeiras_porco
Essa obra é palmeirense?,palmeiras_porco
Por que essa obra é considerada Arte?,dúvida_obra
WTF is that?,dúvida_obra
O que isso representa?,intenção_autor
O que o autor quis passar?,intenção_autor
Qual a proposta do artista com essa figura?,intenção_autor
Qual é a transgressão/ questionamento que se faz nessa obra?,intenção_autor
Qual interpretação podemos ter ?,intenção_autor
Qual mensagem o pintor quis passar?,intenção_autor
Quem foi Nelson Leiner?,biografia_autor
qual o significado da obra,intenção_autor
qual o significado dessa hora,intenção_autor
você torce pelo palmeiras?,palmeiras_porco
qual objetivo da obra,intenção_autor
o que ela representa,intenção_autor
Qual tamanho desse porco,tamanho_porco
Empalhar um animal pode ser considerado um ato de crueldade,sem_resposta
Quantos kg ele pesa?,peso_porco
é um porco de verdade?,tipo_obra
vc conhece a peppa?,relação_peppa_pig
A pessoa que pintou esse quadro era vegetariana?,alimentação_autor
Porco assado,bacon_porco
Bacon,bacon_porco
Quero bacon,bacon_porco
a caixa não é pequena para o porco,caixa_porco
Quem te prendeu dessa forma ?,autor_obra
o que a caixa é feita?,caixa_porco
o que vão fazer com o animal?,história_porco
Qual é o tipo dessa madeira?,caixa_porco
Isso é arte?,dúvida_obra
Esse quadro é uma pintura ou uma foto?,tipo_obra
O que é isso?,tipo_obra
Isso é uma pintura ou uma foto?,tipo_obra
Isso é um porco?,tipo_obra
Isso é uma pintura ? ,tipo_obra
Isso é um porco de verdade?,tipo_obra
Você foi pintado ou é uma fotografia?,tipo_obra
que bicho e esse?,tipo_obra
O que é isso?,tipo_obra
Para onde estão levando o porco?,transporte_porco
Essa obra foi baseada num porco vivo?,porco_morto
O porco estava vivo?,porco_morto
O intuito desse porco é chocar as pessoas?,intenção_autor
O que ele quis transmitir com essa obra?,intenção_autor
O que esse porco simboliza?,intenção_autor
O que isso representa?,intenção_autor
Qual a intenção ao pintar a tela? ,intenção_autor
O porco está sujo?,sem_resposta
Ele é de estimação?,história_porco
o porco vive nesse espaço?,Tempo_porco_caixa
Vão matá-lo?,porco_morto
Por que esse porco está preso?,porco_preso
por que o porco está preso?,porco_preso
Por que o porco está preso?,porco_preso
Por que o porco está preso?,porco_preso
porque ele esta preso?,porco_preso
Porque o porco está preso?,porco_preso
Porque o porco está preso?,porco_preso
"triste o porco preso , por que esta assim ?",porco_preso
por que o porco esta na caixa?,porco_preso
por que ele ta na jaula?,porco_preso
Porque esse porco tá num espaço tão pequeno?,porco_preso
porque te prenderam?,porco_preso
O artista morava em alguma fazenda?,sem_resposta
Como devemos interpretar esta obra?,intenção_autor
Por que voce considera esse porco em uma caixa como arte?,dúvida_obra
Por que esse porco está dentro desse engradado ?,porco_preso
O artista tinha algum trauma de infância com porcos?,história_porco
Esse não é o seu lugar,sem_resposta
Quem fez isso com você?,autor_obra
Quem fez isso?,autor_obra
Existem mais obra do seu criador/pintor que eu possa ver? E onde estão estas obras?,outras_obras
Quem te prendeu?,autor_obra
Qual é o ano da obra?,data_obra
De que ano é essa obra?,data_obra
Esta obra é uma obra de que ano?,data_obra
Em que ano o quadro foi pintado?,data_obra
em que ano foi feita essa pintura ?,data_obra
Em que ano esta obra foi feita?,data_obra
Qual foi o ano de criação desta obra?,data_obra
Qual o ano em que foi pintado?,data_obra
De que ano é?,data_obra
De que ano é ssa obra?,data_obra
em que ano foi efetuada?,data_obra
em que ano foi feita a pintura?,data_obra
Qual o ano de sua criação?,data_obra
Como esse porco foi parar ai dentro?,Tempo_porco_caixa
De onde é o artista?,nascimento_autor
De onde é o artista? Qual é o ano da obra? ,nascimento_autor
o porco está vivo?,porco_morto
Por que o animal está preso?,porco_preso
Porque este porco está preso?,porco_preso
Você gosta que como você,sentimento_porco
Que material que eu for usar numa praia para preencher o porco,técnica_obra
de quem é o porco?,endereço_obra
de quem é o porco?,endereço_obra
Isso é uma foto ou uma pintura?,tipo_obra
O que levou Nelson Leirner pintar esse quadro?,intenção_autor
É um porco de estimação?,história_porco
quem vai comer o porco?,porco_morto
Isso por acaso é arte?,dúvida_obra
quanto pesa o porco?,peso_porco
Será que Nelson era vegetariano ou vegano?,alimentação_autor
Porque o pintor desenhou um porco?,razão_porco
Qual é o estilo dessa gravura?,estilo_obra
Em que período histórico foi pintada?,obra_contexto_histórico
Qual é o seu destino?,história_porco
Qual será o seu destino ?,história_porco
O porco é de verdade?,tipo_obra
Aquilo e um porco?,tipo_obra
Isso é uma pintura ou fotografia?,tipo_obra
É uma foto ou um quadro ? ,tipo_obra
isso é uma foto?,tipo_obra
Qual a história desse artista?,biografia_autor
Porque um porco e nao um cachorro ou outro animal. O que mudaria seria fosse outro animal?,razão_porco
Por que pintar um porco e não outro animal?,razão_porco
qual a relacao do autor com animais de criacao?,sem_resposta
Este animal estava vivo durante a pintura da obra?,porco_morto
o porco está vivo?,porco_morto
Soltaram ele depois?,porco_morto
porque o porco ta preso? será que ele tem dores?,porco_preso
Porque o povo está fechado e uma caixa,porco_preso
É um porco de estimação?,história_porco
Qual é o origem do porco?,história_porco
De onde veio esse porco?,história_porco
O que aconteceu como porco?,história_porco
O porco será abatido?,história_porco
Por que um porco e não outro animal?,razão_porco
Porque foi escolhido um porco?,razão_porco
O que houve com o porco depois da foto?,história_porco
Por que o porco parece sujo?,sem_resposta
Qual é o estilo da obra?,estilo_obra
Que tipo de arte é essa?,estilo_obra
Que tipo de arte é considerada esta ?,estilo_obra
Como você veio parar neste museu?,transporte_porco
Para onde será levado?,transporte_porco
Porque isso é considerado obra de arte?,dúvida_obra
Isso é considerado 'obra de arte'? ,dúvida_obra
Isso é mesmo uma obra de arte ?,dúvida_obra
Até quando vou poder vê-lo aqui neste museu?,endereço_obra
Essa obra está permanentemente exposta na galeria?,endereço_obra
Onde fica esta galeria?,endereço_obra
Esta indo pra o abatedouro?,história_porco
Qual o período dessa arte?,data_obra
Você conhece a Peppa Pig?,relação_peppa_pig
Porque você está preso?,porco_preso
Onde foi exposto,exposição_obra_outros_museus
isso é uma obra de arte?,dúvida_obra
Qual é o sentido desta obra?,intenção_autor
Qual é o origem do porco?,história_porco
Como se sente?,sentimento_porco
"Porquinho, desculpe a humanidade por fazer isso com você?",sem_resposta
É um javali,raça_ porco
Isso é um porco ou um javali?,raça_ porco
Quantos quilos de bacon temos em um porco?,peso_porco
Ele não tem comida?,sem_resposta
De onde o porco veio?,história_porco
você foi capturado na mata?,história_porco
Esse porco é macho capado?,sexo_porco
Quem foi Nelson Leirner? ,biografia_autor
Quem é Nelson Leirner?,biografia_autor
Quem é Nelson Leirner?,biografia_autor
Quem é Nelson Leirner?,biografia_autor
Quem foi Nelson Leirner ?,biografia_autor
Quem foi Nelson Leirner?,biografia_autor
Me conte mais sobre Nelson Leirner,biografia_autor
Quem foi Nelson Leirner?,biografia_autor
quem foi Nelson Leirner?,biografia_autor
Está com medo?,sentimento_porco
Como se sente tão prisioneiro?,sentimento_porco
Você gosta de gente?,sentimento_porco
"Coitadinho, voce nao tem dó!?",sem_resposta
qual é o seu nome?,nome_porco
Voce tem nome ?,nome_porco
Por que não está apoiada no chão?,sem_resposta
quanto pesa esse porco?,peso_porco
Você esta triste?,sentimento_porco
Você quer sair da ai?,sentimento_porco
Ele está transmitindo tristeza?,sentimento_porco
A mensagem deste quadro é a favor ou contra os animais?,intenção_autor
O animal da obra simboliza o que?,intenção_autor
O artista retratou a opressão e confinamento?,intenção_autor
Qual é o sentimento do pintor em relação ao porco? ,intenção_autor
Como era sua vida antes desse momento?,sem_resposta
Porque o animal esta preso?,porco_preso
Porque você esta preso?,porco_preso
Como o nome dele?,nome_porco
O porco confinado num espaço tão pequeno... O pintor estaria chamando a atenção para como as pessoas estão vivendo?,intenção_autor
o que ele quer passar com essa obra?,intenção_autor
Palmeira tem mundial?,palmeiras_porco
De onde é o artista?,nascimento_autor
Onde nasceu o artista?,nascimento_autor
Quando nasceu o artista?,nascimento_autor
Podemos classificar esta obra como arte moderna? Por que?,estilo_obra
Porque eu. Está sendo apresentado dentro de um caixote,intenção_autor
de onde vc veio?,história_porco
Quanto tempo levou para montar essa peça?,duração_obra
quanto tempo levou para fazer?,duração_obra
Qual era a intenção dessa obra,intenção_autor
O que é um pouco está encalhado,técnica_obra
Porque esse espaço tão pequeno para o porco ficar?,intenção_autor
Quais outras obras famosas são de Nelson Leiner?,outras_obras
Quanto tempo o porco esta nessa caixa?,Tempo_porco_caixa
Este porco está morto?,porco_morto
por que o porco está sozinho?,sem_resposta
Que é um porco,sobre_porco
Então é desse porque o que saiu bem com,sem_compreensão
Você é um pouco uma choperia,sem_compreensão
Qual o movimento estava occorendo quando foi criada a obra?,estilo_obra
Foi criada,data_obra
o porco tem cheiro?,sem_resposta
Essa caixa não é pequena para você?,caixa_porco
Esse caixote não e pequeno para ele?,caixa_porco
e uma fotografia  ?,tipo_obra
O que é isso? Um quadro? Uma fotografia?,tipo_obra
Quais premissas esse trabalho instala na arte contemporânea brasileira? ,importância_obra
Onde essa obra está exposta?,endereço_obra
Quais as influencias dos artistas?,influências_autor
Porque amiga da Pepa,relação_peppa_pig
Não me atendeu,sem_compreensão
Qual foi a justificativa pra,sem_compreensão
O que que expor está fedem no,sem_compreensão
Porque tem um povo aqui,sem_compreensão
Existem outros porcos Zinho outras galerias um museu,sem_compreensão
Por que a gaiola é tão pequena?,caixa_porco
Qual tamanho que eu for com,sem_compreensão
A qual período literário esta obra pertence?,estilo_obra
Ele ganhou algum prêmio recentemente?,prêmio_autor
A forma como a caixa está montada tem um significado?,sem_resposta
O que ele faz ai dentro preso?,porco_preso
O que esse porco preso representa?,porco_preso
O que significa este porco preso?,porco_preso
P que significa isso?,intenção_autor
qual o significado disso?,intenção_autor
porque voce desenhou um porco ? qual o significado?,intenção_autor
qual o significado,intenção_autor
qual o significado dessa pintura?,intenção_autor
Qual o significado do quadro?,intenção_autor
O que significa ter um porco dentro de um caixote?,intenção_autor
O que significa um porco gordo enjaulado em uma prisão de madeira,intenção_autor
Qual o significado da tela?,intenção_autor
Qual o significado do porco?,intenção_autor
O que significa essa foto?,intenção_autor
O que esta obra de arte significa?,intenção_autor
qual o significado desta arte?,intenção_autor
O que significa esta imagem?,intenção_autor
o que significa?,intenção_autor
qual o significado desta obra de arte?,intenção_autor
Por que ele está preso?,porco_preso
Por quê este porco está preso dentro da caixa?,porco_preso
Por que o animal está preso?,porco_preso
Essa obra foi exibida internacionalmente?,exposição_internacional_obra
O porco está sendo vendido ou simplesmente preso?,história_porco
Por que o animal estava preso?,porco_preso
por que o porco está preso ?,porco_preso
Por que o Porco está preso ? ,porco_preso
Por que o porco esta preso?,porco_preso
por que o porco está preso?,porco_preso
Por que o porco está preso?,porco_preso
Por que o porco está preso?,porco_preso
Por que o porco está preso?,porco_preso
Por que o porco está preso?,porco_preso
Porque está preso em um espaço tão pequeno?,porco_preso
Porque o porco esta preso em uma jaula de madeira ?,porco_preso
Porque o porco está preso nesta caixa ?,porco_preso
Porque o porco está preso?,porco_preso
Porque o porquinho esta preso?,porco_preso
Porque vc está preso ?,porco_preso
Porque você foi preso nessa caixa?,porco_preso
qual o significado desse porco preso?,porco_preso
Qual o significado do porco preso? ,porco_preso
Quanto tempo vc está preso ?,Tempo_porco_caixa
O que significa este porco nesta caixa?,porco_preso
Qual o endereço da galeria Roger Wright?,endereço_obra
Qual o processo de pintura?,técnica_obra
Isso é uma fotografia ou uma pintura?,tipo_obra
"Isto é uma pintura, um quadro ou um porco de verdade? Qual a intenção do artista?",tipo_obra
Isso é uma pintura ou uma fotografia?,tipo_obra
Isso é uma pintura ou uma fotografia?,tipo_obra
isso é uma pintura?,tipo_obra
Isso é uma pintura ou uma fotografia?,tipo_obra
Este quadro é uma pintura ou uma foto?,tipo_obra
Isso é um pintura?,tipo_obra
Isso é uma fotografia ou pintura ? ,tipo_obra
Isto é uma pintura ou foto?,tipo_obra
isto é uma instalação ou uma pintura ?,tipo_obra
isso é uma pintura?,tipo_obra
É pintura ou é real?,tipo_obra
É pintura ou é uma foto?,tipo_obra
É uma pintura ou é uma foto real ?,tipo_obra
é um palmeirense preso?,palmeiras_porco
Isso é arte?,dúvida_obra
Isso é arte?,dúvida_obra
Isso é arte?,dúvida_obra
Esse tipo de instalação pode ser considerado arte?,dúvida_obra
Qual é o estilo da obra?,estilo_obra
Que estilo de arte  esta obra se enquandra?,estilo_obra
quantos anos tem esse porco?,idade_porco
Qual foi a técnica utilizada?,técnica_obra
Por qual motivo um porco preso em uma caixa pode ser considerada arte?,dúvida_obra
Onde fica a Galeria Roger Wright?,endereço_obra
Por que essa foto é uma arte?,dúvida_obra
Como este porco foi enjaulado?,sem_resposta
o porco é de verdade?,tipo_obra
Qual o estilo artístico desta obra?,estilo_obra
Qual o movimento artistico essa pintura faz parte?,estilo_obra
Existe algum movimento artistico onde esta obra se encaixa?,estilo_obra
Em que ano foi pintado?,data_obra
Em que ano esta obra foi pintada?,data_obra
Quando ela foi exposta a primeira vez?,exposição_obra_outros_museus
De onde é o artista? Qual é o ano da obra? ,nascimento_autor
O porco ficou preso enquanto o artista pintava?,tipo_obra
qual a tecnica utilizada nesta obra?,técnica_obra
Por que este pintor pintou um porco preso em um caixote?,porco_preso
Qual a relevância do animal vivo preso em uma jaula?,porco_preso
O que você está fazendo dentro das grades,porco_preso
Esse é um porco empalhado,tipo_obra
Quantos anos tinha o pintor quando pintou a tela?,biografia_autor
Porque o porco está presa,porco_preso
O que é sobra significa,intenção_autor
O pintor era fazendeiro ou prezava pelo tratamento aos animais?,sem_resposta
ele é um cofrinho gigante?,tipo_obra
Você é um porco,tipo_obra
esse porco seria vendido ou estava em cativeiro?,história_porco
Quais são os seus ancestrais?,evolução_porco
Qual a linha de evolução deste porco?,evolução_porco
O Nelson lembro fez alguma outra obra com bicho empalhado,outras_obras
Qual o periodo da obra?,data_obra
Nelson Leirner é vegetariano?,alimentação_autor
O artista é vegetariano?,alimentação_autor
é de madeira?,caixa_porco
Quantos anos você tem?,idade_porco
Quantos anos tem o porco?,idade_porco
Esse porco tem quantos anos?,idade_porco
Qual o ano de nascimento desse animal? ,idade_porco
Qual o nome desta obra?,nome_obra
Quem é Nelson Lerner,biografia_autor
 Qual a técnica utilizada?,técnica_obra
Porque o porco estava preso?,porco_preso
Porque vc esta preso ?,porco_preso
Porque você esta preso?,porco_preso
Porquinho aonde você pensa em ir,sem_resposta
O que você vez para estar preso ?,história_porco
O que esta obra representa?,intenção_autor
o que isto representa?,intenção_autor
O que o autor quis mostrar com essa figura?,intenção_autor
Onde o autor da obra estava quando pensou nesta obra e o porquê desta obra?,intenção_autor
Seria um protesto?,intenção_autor
O que o artista quis dizer com essa obra?,intenção_autor
quem fez,autor_obra
a técnica de pintura dele tem algum nome ou classificacao,técnica_obra
Por que o porco está preso?,porco_preso
Porque o porco está preso?,porco_preso
Por que este porco está ai?,porco_preso
Por que não soltam o porco?,porco_preso
Por que prenderam o porco?,porco_preso
qual o peso ?,peso_porco
isso é arte?,dúvida_obra
vc é amigo da peppa pig?,relação_peppa_pig
O autor era vegetariano?,alimentação_autor
Qual a raça desse animal? ,raça_ porco
Que tipo de porco é esse?,raça_ porco
Por que um porco?,razão_porco
Porque esta obra é considerada arte?,dúvida_obra
O que o artista imaginou que as pessoas sentiriam quando vissem essa obra de arte?,intenção_autor
Quem fez,autor_obra
Qual a arte relacionada a manter um porco preso ?,dúvida_obra
Qual é nome da obra ?,nome_obra
O porco estava vivo?,porco_morto
o porco ta vivo?,porco_morto
Por que o porco esta preso ? ,porco_preso
Por que o porco está preso?,porco_preso
Por que o porco está preso?,porco_preso
Porque o porco está preso ? ,porco_preso
conhece a peppa?,relação_peppa_pig
esse porco veio de alguma fazenda?,história_porco
Porque o porco está dentro da caixa? ,porco_preso
O que te motivou a colocar um animal em uma gaiola?,porco_preso
por que o porco está de castigo?,porco_preso
por que prenderam o porco?,porco_preso
Que técnica foi utilizada?,técnica_obra
descreva sobre obra,intenção_autor
você conhece a Pepa Pig?,relação_peppa_pig
de onde veio o porco?,história_porco
isto é arte?,dúvida_obra
De qual cidade você veio?,local_criação_obra
Em que país a obra foi produzida?,local_criação_obra
Para onde ele está indo?,transporte_porco
Para onde esse porco esta sendo transportado?,transporte_porco
Não existe maldade nessa imagem?,porco_morto
Foi legal separar,sem_compreensão
Você é um porco é uma Boletta,sem_compreensão
Tem que segurar aqui né,sem_compreensão
E desenhos com a com a com as,sem_compreensão
Que frescura cores,sem_compreensão
Tão pequeno,sem_compreensão
Porque ela ganhou,sem_compreensão
Pode pá,sem_compreensão
Oi,sem_compreensão
Você é meio da fé Fabi,sem_compreensão
Qual foi inspiração do artista pra essa obra do porco,intenção_autor
porque um porco?,razão_porco
Quais materiais usados na obra?,técnica_obra
Qual a critica da pintura?,intenção_autor
o que quer dizer esse quadro?,intenção_autor
me explica esse quadro,intenção_autor
Essa obra é uma critica ou uma constatação?,intenção_autor
O que o Nelson Leirner quis dizer com esta obra?,intenção_autor
qual o conceito?,intenção_autor
qual o segnificado da obra ?,intenção_autor
Qual o propósito da obra?,intenção_autor
Qual a intenção por detrás desta obra?,intenção_autor
qual a motivaçao de fazer essa obra?,intenção_autor
Isso é uma crítica a forma como vivemos hoje em dia?,intenção_autor
"Se a arte é o reflexo do contexto sócio-econômico de uma época, o que pretendia o artista ao apresentar um caixote de madeira de feira com um porco dentro? Qual a relação do porco com a sociedade humana nesse contexto?",intenção_autor
Porque um porco em um caixote?,intenção_autor
Qual a intenção do artista ao representar isso ?,intenção_autor
Qual possivel inspiracão o autor teve?,intenção_autor
Qual o objetivo da obra?,intenção_autor
Que sentimento inspirou o artista?,intenção_autor
qual o sentimento quer expressar? qual a reflexao? ,intenção_autor
Ele queria causar algum impacto?,intenção_autor
Há alguma espécie de crítica social relacionada a obra? ,intenção_autor
Qual simbologia disso?,intenção_autor
Qual foi a inspiração para a obra?,intenção_autor
Qual foi a inspiração?,intenção_autor
como um porco pode ser arte ?,dúvida_obra
O que é isso ?,tipo_obra
O que é isso dentro da caixa?,tipo_obra
Esse porco é de verdade?,tipo_obra
Por que estes materiais foram utilizados?,técnica_obra
O que é isso?,tipo_obra
É um porco de verdade?,tipo_obra
Esse porco é de verdade?,tipo_obra
Esta obra é modernista?,estilo_obra
Esta obra é modernista?,estilo_obra
O autor utilizou um modelo real,tipo_obra
Porque ele fica nessa galeria ? ,sem_resposta
Quem é o autor da obra?,autor_obra
quem é o autor?,autor_obra
Quem é o autor ?,autor_obra
O que o autor quis retratar?,intenção_autor
O que o autor quer mostrar com a obra?,intenção_autor
Qual é o intuito do autor da obra?,intenção_autor
o que o autor queria expressar com esta obra?,intenção_autor
O que o autor da obra quer dizer ao observador?,intenção_autor
O que o autor quis mostrar com esta obra?,intenção_autor
que sentimentos o autor queria expressar?,intenção_autor
Qual era a inspiração do autor?,intenção_autor
o que isso representa na visao do autor? ,intenção_autor
o que o autor quis retratar?,intenção_autor
"Nao entendi o sentido dessa obra, no que o autor estava pensando?",intenção_autor
O porco ainda está vivo?,porco_morto
A obra tem ligação com direitos dos animais?,intenção_autor
