Example,Class Name
Quando ele foi feito,data_obra
Em que ano ele comprou,data_obra
a obra também não tinha um presunto onde está o presunto,corrente_porco
me explique sobre a obra o porco,intenção_autor
esta obra pertence a pinacoteca,endereço_obra
de onde é o artista de que cidade,nascimento_autor
de onde o artista,nascimento_autor
como que é seu nome mesmo,nome_porco
isso explica a obra,intenção_autor
porque ele quis fazer essa escultura,intenção_autor
me explique sobre a obra,intenção_autor
o que representa o porco,intenção_autor
o que é sobre representa,intenção_autor
o porco tinha nome,nome_porco
como é que você chama,nome_porco
Como que é seu nome porco,nome_porco
Qual que é seu nome,nome_porco
o que esse porco é feito,técnica_obra
que material você é feito ele empalhado,técnica_obra
fale sobre o autor,biografia_autor
com história desta obra,história_porco
fale sobre ocorra,história_porco
Qual história da obra,história_porco
Em que ano foi criado essa obra,data_obra
nelson o nelson tem outras obras parecidas,outras_obras
e ele mora onde,endereço_obra
o que é essa obra,intenção_autor
qual é o significado da caixa,intenção_autor
o que representa obra o porco,intenção_autor
qual contexto da obra,intenção_autor
que que significa o porco,intenção_autor
qual qual é o nome do porto,nome_porco
que que você gosta de comer,alimentação_porco
porque é isso é considerado arte,dúvida_obra
quem pintou essa obra,autor_obra
você gosta de bacon,alimentação_porco
qual é a origem do porco,história_porco
porque você está no caixote,porco_preso
qual é o estilo da obra,estilo_obra
porque botar um pouco aí,intenção_autor
qual a intenção de de estar dentro da caixa,porco_preso
porque um porco foi,razão_porco
Porque ele escolheu um pouco,razão_porco
quantos anos,idade_porco
o que aconteceu com você,história_porco
história da obra,história_porco
finalidade do porco,intenção_autor
em que contexto as por que foi criado,obra_contexto_histórico
você tem outra obra de do nelson lerner aqui na pinacoteca,outras_obras
e quais são outras obras desse mesmo autor que são referentes,outras_obras
eu queria saber mais sobre o contexto da obra,intenção_autor
o que você representa,intenção_autor
você tem nome,nome_porco
qual o nome do porco,nome_porco
qual o tamanho desse porco,tamanho_porco
qual é o seu nome what são,sem_compreensão
qual foi o primeiro museu que foi visitado com essa obra,exposição_obra_outros_museus
então porque porque escolheu porco,razão_porco
o porco ele veio de onde,história_porco
pode história sobre este porco,história_porco
para qual a história desse porco,história_porco
foi feito em que ano,data_obra
quando foi feita essa hora,data_obra
qual objetivo,intenção_autor
onde foi criado,local_criação_obra
qual é o nome dessa obra,nome_obra
qual a proposta da obra,intenção_autor
o que ela quer dizer,intenção_autor
porque essa obra,intenção_autor
o que quer dizer o porco,intenção_autor
sobre a obra,intenção_autor
o que significa obro porco,intenção_autor
que este porco representa,intenção_autor
porque o artista fez essa obra,intenção_autor
significa esse porco,intenção_autor
o que é watson,outras_inteligências_artificiais
como você se chama,nome_porco
qual é seu nome por,nome_porco
qual é o nome do foro,nome_porco
você tem um nome,nome_porco
Você tem nome,nome_porco
quais são as outras só pra ver se aqui está,sem_compreensão
por quem é você,nome_porco
onde essa obra foi exposto também,exposição_obra_outros_museus
em quais lugares ela foi exposto anteriormente,exposição_obra_outros_museus
porque vai um pouco,razão_porco
E porque que ele escolher um porco,razão_porco
qual é a idade do porco,idade_porco
quantos anos ela tem,idade_porco
qual a história da construção dessa obra,história_porco
qual sua história,história_porco
em que ano foi feita sombra,data_obra
de que ano é essa obra,data_obra
de que período esta obra de arte,data_obra
Quando foi feita a obra do porco,data_obra
Em que ano ela foi feita,data_obra
cadeu presunto,corrente_porco
com a finalidade desta obra,intenção_autor
o que o artista que isso representa conheço,intenção_autor
Quando você nasceu,nascimento_autor
o que esta obra representa,intenção_autor
o que o artista quer transmitir com a obra,intenção_autor
o que que representa setor,intenção_autor
qual significado pouco,intenção_autor
este porco tem nome,nome_porco
O que é o porco,sobre_porco
comentário geral sobre a obra,intenção_autor
O que essa obra,sem_compreensão
porque isso é considerado anti,dúvida_obra
quantos anos tem um porco,idade_porco
quem foi nelson né,biografia_autor
de onde você veio,história_porco
Cadê o presunto que foi roubado durante a execução da obra,corrente_porco
qual é o propósito dessa escultura,intenção_autor
qual o significado da,intenção_autor
quanto tempo levou pra executar a obra,duração_obra
porque amiga da pé pe,relação_peppa_pig
qual o nome desse porco,nome_porco
de onde esse artista veia,nascimento_autor
ele come o que ele come o que,alimentação_porco
no que essa obra em basada,intenção_autor
sobre a obra um pouco,intenção_autor
qual o sentido dessa obra,intenção_autor
qual o conceito do artista,intenção_autor
Qual o significado do porco,intenção_autor
como que é o seu nome,nome_porco
como era o nome desse porco,nome_porco
o que é um porco,sobre_porco
o que você comia,alimentação_porco
o que representa o engradado,porco_preso
porque eu porque é considerado uma obra de arte,dúvida_obra
quantos anos tem a obra,idade_porco
quantos anos você tem por,idade_porco
qual é a história do artista,biografia_autor
me fala sobre você por,história_porco
de onde ele veio,história_porco
qual é a história de sua obra,história_porco
em que ano essa obra foi,data_obra
qual a data da arte,data_obra
o que a obra significa,intenção_autor
qual a intenção do artista com a obra,intenção_autor
que outras obras tem aqui nesse museu desse fato,outras_obras
que que é o porco,sobre_porco
o que representa,intenção_autor
qual o nome desse,nome_porco
pouco tem nome,nome_porco
como se chama um pouco,nome_porco
Qual seu nome,nome_porco
você gosta de bacon,alimentação_porco
Porque ele comprou um pouco,razão_porco
quantos anos tem esse porco,idade_porco
Quantos anos porque eu tinha,idade_porco
qual a história do porco,história_porco
De que ano essa obra,data_obra
o que representa sobra,intenção_autor
o que significa o produto,intenção_autor
qual o significado dele,intenção_autor
o que esse porco representa,intenção_autor
Qual objetivo dessa vaga,intenção_autor
o que que você come,alimentação_porco
qual o nome dessa obra,nome_obra
o sentido do engradado de madeira,porco_preso
porque é um porco empalhado,razão_porco
Porque ele usou um porco,razão_porco
ele viveu quantos anos,idade_porco
o que foi feito um pouco,técnica_obra
que material foi utilizado para fazer essa obra,técnica_obra
qual é história desta obra,história_porco
qual a história,história_porco
qual história da ob,história_porco
em que ano foi feito,data_obra
porque a obra,intenção_autor
qual é a finalidade dessa obra,intenção_autor
qual o significado,intenção_autor
onde o autor da obra nasceu,nascimento_autor
você mora onde,endereço_obra
existem outras obras do mesmo autor nesta mesma linha,outras_obras
o artista nelson ainda está vivo,morte_autor
de onde é o autor,nascimento_autor
o que fez cleuson lerner,intenção_autor
qual foi a inspiração do artista,intenção_autor
qual é o nome,nome_porco
qual era o nome do porco,nome_porco
qual é o seu nome,nome_porco
Qual era o nome do porco,nome_porco
até quando ela vai ficar na pinacoteca,endereço_obra
o porque palmeirense,palmeiras_porco
você é muito gordo,peso_porco
você é primo da até pra pig,relação_peppa_pig
porque que ele está preso,porco_preso
essa obra pertence a pinacoteca,endereço_obra
esse porco tem nome,nome_porco
quando que tu comprou esse por,sem_resposta
as polêmicas sobre essa obra,razão_porco
quando isso foi feito,data_obra
de que ano que essa obra,data_obra
qual é a mensagem que o artista quer transmitir com esta obra,intenção_autor
existem mais obras iguais a essa,outras_obras
o artista é de que de que cidade,nascimento_autor
a carcaça do porque de verdade,tipo_obra
o o que é representado na sua obra,intenção_autor
qual objetivo da ob,intenção_autor
qual o nome dos porco,nome_porco
Me fale um pouco sobre essa obra,intenção_autor
porque um pouco,razão_porco
Porque é um porco,razão_porco
qual a técnica utilizada para manutenção do por,técnica_obra
o que que aconteceu com você,história_porco
qual a sua história porco,história_porco
em qual país,local_criação_obra
o artista nesta obra tem outras obras de arte também,outras_obras
me explique a obra,intenção_autor
o que que ele queria transparecer na obra,intenção_autor
o que representa obra,intenção_autor
o que é a obra o porco,intenção_autor
O que ele quis mostrar com um pouco,intenção_autor
qual o nome do outro,nome_porco
Qual o nome do porco,nome_porco
Qual o seu nome,nome_porco
que que esse porco come,alimentação_porco
porque ele fez um porco,razão_porco
quantos anos tem um poi,idade_porco
quem foi nelson line,biografia_autor
me fale sobre o autor da obra,biografia_autor
quem foi nelson werneck,biografia_autor
A origem,história_porco
quando esta obra foi criada,data_obra
Qual o ano da sua obra,data_obra
Quando foi feita,data_obra
Qual é o ano da obra,data_obra
e o presunto,corrente_porco
o que inspirou partes cá pra fazer essa obra,intenção_autor
o que significa sobra,intenção_autor
porque você é amigo da pé pa pig,relação_peppa_pig
ela ganhou prêmio isso,prêmio_autor
intenção do autor sobre a obra,intenção_autor
quadro representa,intenção_autor
que ela representa,intenção_autor
Mas tem alguma finalidade,intenção_autor
O que o porco representa para o autor,intenção_autor
ei o que você come,alimentação_porco
quarto quando você nasceu,sem_compreensão
porque empalharmo esse porco,sem_resposta
porque você é considerado obra de arte,dúvida_obra
porque um pouco e não o leão,razão_porco
porque relacionar um pouco porco a essa hora,razão_porco
Porque escolheu porco,razão_porco
qual é a idade do,idade_porco
qual origem desse porco,história_porco
Quando esta obra foi criada,data_obra
qual objetivo dessa obra,intenção_autor
existem obra similares,outras_obras
e raça é esse porco,raça_ porco
ele nasceu 2017,nascimento_autor
qual é o significado desse pouco,intenção_autor
e qual é a mensagem da obra,intenção_autor
o que o porco representa,intenção_autor
Que é a obra.,intenção_autor
como é o nome desse por,nome_porco
como você chama,nome_porco
quanto tempo demorou pra se fazer essa obra,duração_obra
quanto tempo demorou pra fazer a obra,duração_obra
você é obra de arte mesmo,dúvida_obra
esse porque está morto,porco_morto
qual a data da obra,data_obra
quanto tempo levou a obra ser feita,duração_obra
em que época foi feita atenção por,sem_compreensão
Quando que você foi empalhada,porco_morto
o significado da cerca,porco_preso
qual astória da obra,história_porco
em quais locais esteve essa obra,exposição_obra_outros_museus
quantos anos tem o porco,idade_porco
quem é nelson,biografia_autor
quando ele fez esta obra,data_obra
de que ano você é,data_obra
Porque está sem o pernil na corrente,corrente_porco
qual a raça dele por,raça_ porco
o porco feliz,sentimento_porco
o nelson ainda está vivo,morte_autor
qual o nome do povo,nome_porco
qual o propósito desse,intenção_autor
o que o artista queria dizer com essa obra,intenção_autor
Qual significado por,intenção_autor
qual o nome do porto,nome_porco
qual é o nome dele,nome_porco
que que você come,alimentação_porco
o que você come não,alimentação_porco
qual contexto histórico dessa obra,obra_contexto_histórico
qual é o tamanho dela,tamanho_porco
fale me mais sobre a sombra,intenção_autor
onde foi resposta esta obra,exposição_obra_outros_museus
porque o porco,razão_porco
quantos anos um pouco tinha quando morreu,idade_porco
quantos anos tenho por,idade_porco
porco coisas materiais do pouco,técnica_obra
quais são os materiais utilizados para construção da obra,técnica_obra
e com material esse paper feito,técnica_obra
qual o material pra fazer,técnica_obra
da onde ele é,história_porco
qual é a sua história,história_porco
qual a sua história,história_porco
qual ano da obra,data_obra
de que ano esta obra,data_obra
de que ano é a obra,data_obra
em que ano essa obra foi feita,data_obra
quando foi pintado isso,data_obra
quando foi feito,data_obra
em que ano foi feita está lá,data_obra
qual é a data de sua criação,data_obra
quando essa obra foi feita,data_obra
Qual o ano,data_obra
Quando esse porco é feito,data_obra
porque a corrente foi retirada,corrente_porco
Cadeu presunto que de via está aqui,corrente_porco
qual contexto da sogra,intenção_autor
sobre o que essa obra,intenção_autor
porquinho quanto tempo atiçou levou pra fazer você,duração_obra
quais outras obras famosas desse artista,outras_obras
o que que foi inspirado por,sem_compreensão
o que tem um pouco na caiola,sem_compreensão
onde a sua obra foi resposta,exposição_obra_outros_museus
porque ele escolher um porco,razão_porco
porque ele pagar um porco,razão_porco
qual a idade,idade_porco
como essa obra foi feita,técnica_obra
de quais materiais foram feito esse povo,técnica_obra
com a história deste porte,história_porco
da onde você vem,história_porco
quando foi feito o porco,data_obra
quando ela foi criada,data_obra
Que ano que você foi criada,data_obra
Em que ano você foi criada,data_obra
qual o significado dessa obra,intenção_autor
porque eu porque está preso,porco_preso
quais outras obras do autor,outras_obras
nacionalidade,nascimento_autor
ele é brasileiro,nascimento_autor
nasceu quando,nascimento_autor
qual o propósito do povo,intenção_autor
qual a ideia por trás,intenção_autor
o que o autor de representar com a sobra,intenção_autor
o que quer dizer essa obra,intenção_autor
qual o sentido da obra,intenção_autor
qual significado,intenção_autor
o que é esta obra,intenção_autor
o que representa pouco,intenção_autor
o que representa essa obra,intenção_autor
O que representa este por,intenção_autor
qual é o nome do porto,nome_porco
como é o nome desse povo,nome_porco
do que você se alimenta,alimentação_porco
quanto tempo levou para que a sua obra ficasse pronto,duração_obra
você está feliz,sentimento_porco
quem foi nelson lerner glenia,biografia_autor
por que você é uma obra de arte,dúvida_obra
porque que o porquinho foi criado,razão_porco
Porque é porco,razão_porco
como panco foi feito,técnica_obra
eu te amo como que você foi feito,técnica_obra
qual origem da sogra,história_porco
de onde veio esse por,história_porco
me fale tudo que você tem sobre o porco,história_porco
qualquer origem da obra,história_porco
Fale um pouco da obra porco,história_porco
que ano foi criado o porco,data_obra
Quando você foi criada,data_obra
De quando é a obra,data_obra
o que que aconteceu com pernil,corrente_porco
pelo pq está triste,sentimento_porco
oi porquinho qual que é o seu nome,nome_porco
explique sobre a obra,intenção_autor
me explica é obra do povo,intenção_autor
O que significa pouco enjaulado,intenção_autor
Qual a ideia do porque,intenção_autor
qual o nome desse por,nome_porco
queria saber se o porco tem nome,nome_porco
o porco tem nome,nome_porco
não qual é o nome do porco,nome_porco
como que chama porco,nome_porco
você é amigo da pepa pig,relação_peppa_pig
o porco tinha quantos anos,idade_porco
quando esses cultura foi criada,data_obra
qual é o peso,peso_porco
quem é o quem é o autor,autor_obra
qual história dessa obra,história_porco
quantos anos você vinha,idade_porco
você gostaria de sair aqui,sem_resposta
o que que isso que apresenta para hart,estilo_obra
o que quem era o porco,história_porco
data de criação,data_obra
você foi feito em que ano,data_obra
pq está triste,sentimento_porco
o que é estar obra significa,intenção_autor
porque foi feita essa obra,intenção_autor
este porco tinha um nome,nome_porco
rês porque a arte,sem_compreensão
em quais lugares essa obra já foi exposto,exposição_obra_outros_museus
porque eu artista escolher um porco,razão_porco
quantos anos esse porco tem quantos anos esse porco te,idade_porco
quantos anos você tinha quando morreu,idade_porco
Quantos anos ele tinha,idade_porco
quais materiais que foram usadas para confecção dessa obra,técnica_obra
de onde veio esse porco,história_porco
data da confecção do pouco,data_obra
quando essa obra foi criada,data_obra
o que essa imagem representa,intenção_autor
qual a raça do porco,raça_ porco
é brasileiro,nascimento_autor
sobre o que a sua obra,intenção_autor
de que trata,intenção_autor
o que ele representa,intenção_autor
qual que é o sentido dessa obra de arte,intenção_autor
o que representa esta obra,intenção_autor
O que significa um pouco,intenção_autor
Pra que serve,intenção_autor
qual é o nome desse porco,nome_porco
como chama,nome_porco
esse povo tem nome,nome_porco
Ele tem nome,nome_porco
o que o porco come,alimentação_porco
qual tamanho desse porco,tamanho_porco
me fale sobre a obra,intenção_autor
como quando e a sauda foi criada,sem_compreensão
qual foi o ano em que essa obra foi resposta,exposição_obra_outros_museus
porque tem um porco aqui,razão_porco
hoje ele tem quantos anos,idade_porco
quais são os materiais utilizados,técnica_obra
fale me sobre o pouco,história_porco
qual a história deste porco,história_porco
qual o ano,data_obra
quando foi feito esse quadro do por quatro,data_obra
a obra representa,intenção_autor
e qual a ideia,intenção_autor
qual é a mensagem que ele quis passar com esta obra,intenção_autor
o que ele significa,intenção_autor
o que eu porque significa,intenção_autor
qual foi a intenção do artista realizar essa obra,intenção_autor
porque ele fez isso,intenção_autor
Qual que o nome dele,nome_porco
porque ele fez o porco,razão_porco
porque até um pouco,razão_porco
qual o material desse porco por,técnica_obra
ele foi preenchido com outro material dentro,técnica_obra
cara história da obra,história_porco
qual a história da obra,história_porco
Origem,história_porco
quando foi feita a obra,data_obra
Em que ano foi feita @,data_obra
Qual o ano de criação da obra,data_obra
porque não se utiliza mais o pernil,corrente_porco
qual é o significado do porco vou entender mais uma vez,intenção_autor
você é feliz,sentimento_porco
qual ideia quero transmitir essa obra,intenção_autor
porque o autor quis dizer com essa obra,intenção_autor
qual é o significado,intenção_autor
O que ele quer dizer com essa obra,intenção_autor
qual o seu nome,nome_porco
qual é o nome do porco,nome_porco
Qual é o seu nome,nome_porco
porco o que que você gosta de comer,alimentação_porco
quanto tempo demorou pra fazer sauna,duração_obra
Fale-me sobre a obra,intenção_autor
que eu preciso saber sobre a sobra,intenção_autor
o que o artista quis fazer colocando esse amor dentro da caixa,porco_preso
essa obra já esteve em quais modelos,exposição_obra_outros_museus
porque que ele foi criado,razão_porco
e o que que é feito por,técnica_obra
qual a história desse porco,história_porco
o que sobra quer dizer,intenção_autor
qual a finalidade da sala,intenção_autor
o que significa obra,intenção_autor
qual o significado da sogra,intenção_autor
Qual é a ideia do porco,intenção_autor
quem é você é watson,outras_inteligências_artificiais
o que é que ele come,alimentação_porco
porque empalharam esse porco,sem_resposta
quantos anos tem esse porco aqui no música,sem_compreensão
porque ele quis empalhar um pouco,porco_morto
é porque ele foi inventado,razão_porco
Porque em pagar um porco,razão_porco
recíproco está aí há quantos anos,idade_porco
que material foi utilizado,técnica_obra
fale me sobre o autor,biografia_autor
de mesmo veio de que país o porco,história_porco
história do quadro,história_porco
Qual foi o destino do porco,história_porco
de quando essa obra,data_obra
quando ela foi feita,data_obra
quando foi feita essa obra,data_obra
De quando esta obra,data_obra
aonde está o presunto,corrente_porco
onde está o presunto,corrente_porco
o que o artista quis dizer,intenção_autor
o que você quis dizer com esse porco,intenção_autor
qual o significado do porco,intenção_autor
do que se trata obra do porco,intenção_autor
o que que essa obra representa,intenção_autor
qual nome dele,nome_porco
o que é o porco,sobre_porco
porque o porco engaiolado,intenção_autor
por quantos exposições gostava de arte já passou,exposição_obra_outros_museus
porque isso é arte,dúvida_obra
porque o moço fez isso com o porco,razão_porco
porque fizeram com o porco,razão_porco
porque é justamente o suíno,razão_porco
porque é um pouco,razão_porco
quantos anos eu perco tem,idade_porco
quantos anos você tem,idade_porco
quantos anos que ele está aí,idade_porco
de que material é feito por,técnica_obra
de qual material é feito escultura,técnica_obra
O material produzido,técnica_obra
De que material ele assunto,técnica_obra
fale um pouco sobre artista,biografia_autor
quem é nelson lerner,biografia_autor
de onde o porco veio,história_porco
qual a história desse por,história_porco
quando é que essa porra foi feito,data_obra
qual a data de criação,data_obra
de que ano,data_obra
em que ano mesmo que foi criado esse quadro,data_obra
De quando essa obra,data_obra
Em que ano ele fez você,data_obra
De que ano que essa obra,data_obra
e porque queria corrente e o pernil que tinha antes,corrente_porco
Cadeu pedaço de pernil quer amarrado,corrente_porco
qual era a intenção do artista fazer esta obra,intenção_autor
o que o artista quis propor com a sobra,intenção_autor
porque você fez essa obra,intenção_autor
o que que porque está sentindo,sentimento_porco
da onde autor,nascimento_autor
o autor é brasileiro,nascimento_autor
qual a história dessa obra,história_porco
Porque ele comprou porco,razão_porco
como foi feito por,técnica_obra
conte me mais sobre o artista nelson lerner,biografia_autor
de quem era o porco,história_porco
Origem da obra,história_porco
de que ano essa arte,data_obra
Em que época,data_obra
o porco é feliz,sentimento_porco
você quer sair daqui,sentimento_porco
qual a proposta,intenção_autor
que significa a obra,intenção_autor
oi qual seu nome,nome_porco
Qual o nome desse for com,nome_porco
e que ele come,alimentação_porco
watson como você funciona,sem_resposta
fale mais sobre a obra,intenção_autor
ele tem dono,sem_resposta
explique mais sobre matéria forma,sem_resposta
qual material utilizado na obra,técnica_obra
quem é nelson limeira,biografia_autor
qual história do porco,história_porco
quando sobra foi feita,data_obra
qual é o significado dessa obra,intenção_autor
o que se trata só,intenção_autor
quando você nasceu,nascimento_autor
e quando ele nasceu,nascimento_autor
onde nasceu,nascimento_autor
o que ela significa,intenção_autor
que ele representa,intenção_autor
qual é a ideia dessa obra,intenção_autor
o que significa a caixa,intenção_autor
o que é obra representa,intenção_autor
qual é o seu nome por,nome_porco
como é seu nome,nome_porco
o que eu pouco comi,alimentação_porco
me fale sobre esta obra,intenção_autor
qual a procedência,sem_compreensão
quantos anos tens por,idade_porco
antes de material é obra,técnica_obra
qual a história do por,história_porco
qual a data do trabalho,data_obra
Quando foi feito a obra,data_obra
qual a inspiração da obra,intenção_autor
qual a proposta da obra,intenção_autor
o que é isso que eu estou representa,intenção_autor
porque ele fez a escultura com porco,intenção_autor
pouco era feliz,sentimento_porco
disco explique a obra do porco,intenção_autor
que que quer dizer esse porco,intenção_autor
que significa,intenção_autor
o que significa essa,intenção_autor
qual é o sentido disso,intenção_autor
qual a intenção do artista,intenção_autor
qual é o que é o nome,nome_porco
Porco qual é o seu nome,nome_porco
que ver o que que você gosta de comer,alimentação_porco
de onde é nelson lerner,nascimento_autor
e porque o porco,razão_porco
quantos anos tempo,idade_porco
quantos anos estaria ser porque se ele tivesse vivo,idade_porco
De que época é,data_obra
onde está a peça de pernil,corrente_porco
que significa essa obra,intenção_autor
o que o artista que as fazer com porco,intenção_autor
você está triste aí dentro,sentimento_porco
o que a obra um pouco,intenção_autor
o que representa um porco,intenção_autor
qual o contexto da sua obra,intenção_autor
o que inspirou esta obra,intenção_autor
qual o conceito,intenção_autor
o que você significa,intenção_autor
que significa o porco,intenção_autor
o que significa esse porco,intenção_autor
onde esta obra fica originalmente,endereço_obra
porque um porco,razão_porco
qual o material usado um pouco,técnica_obra
sobre o corpo,história_porco
fale tudo sobre o porco,história_porco
qual história da obra,história_porco
em que ano que foi feita,data_obra
quando que foi feita essa obra,data_obra
o que isso significa,intenção_autor
qual inspiração da obra,intenção_autor
Outras obras,outras_obras
quando ele nasceu,nascimento_autor
como se chama o pó,nome_porco
qual a intenção que ele fez o porco,intenção_autor
qual inspiração pra obra,intenção_autor
e o que significa essa hora,intenção_autor
quem é você watson,outras_inteligências_artificiais
what são o porco tem nome,nome_porco
